{"jurisdiction":{"authority_contract_id":"GEO-AUTH-2025-001","authority_reviewed_date":"2026-08-01","batch_id":"CO-NORM-002","canonical_target_geoidfq":"1600000US0801530","classification":"Statutory Town","county_name":"Park County","geography_basis":"DS-005 Geography_Disposition","geography_qa_status":"PASS","geoid":"0801530","government_form":null,"jurisdiction_id":"jurisdiction-co-alma","jurisdiction_type":"Municipality","municipal_type":"Town","name":"Alma","notes":"CO-NORM-002 normalized Alma's post-2026 statutory-town structure, townwide division, Board of Trustees, 5 elected seats represented by 2 Office records, 5 current holders, Census identifiers, and 2 townwide address controls. The Utilities Board membership-rule conflict remains open/nonblocking and no current Utilities Board membership count was normalized. Formal QA and all downstream gates remain separately gated.","ocd_jurisdiction_id":"ocd-jurisdiction/country:us/state:co/place:alma/government","official_url":"https://townofalma.com/","place_fips":"01530","publication_target":"GEOGRAPHY_AND_JURISDICTION","release_ready":true,"row_updated_at":"2026-08-19","source_disposition":"CANONICAL","source_geoidfq":"1600000US0801530","source_ids":"src-co-alma-census-incplace-2025; src-co-alma-board-trustees; src-co-alma-elections; src-co-alma-meetings; src-co-alma-meeting-minutes; src-co-alma-municipal-code; src-co-alma-contact; src-co-alma-park-county-gis; src-co-alma-boards-commissions-code; src-ds005-geography-disposition-alma; src-co-alma-venues","source_layer":"PLACE","state_abbr":"CO","state_fips":"08","status":"ACTIVE"},"provenance":{"source_assertions":[{"assertion_id":"asrt-co-alma-classification","batch_id":"CO-NORM-002","confidence":"HIGH","jurisdiction_id":"jurisdiction-co-alma","normalized_status":"NORMALIZED","notes":"Normalized into 01_Jurisdiction.","object_type":"TEXT","object_value":"Statutory Town","observed_text":"Alma is governed as a Colorado statutory town.","predicate":"classification","source_id":"src-co-alma-municipal-code","source_locator":"Municipal code / election structure","subject_id":"jurisdiction-co-alma","subject_type":"Jurisdiction"},{"assertion_id":"asrt-co-alma-county","batch_id":"CO-NORM-002","confidence":"HIGH","jurisdiction_id":"jurisdiction-co-alma","normalized_status":"NORMALIZED","notes":"Normalized into 01_Jurisdiction.","object_type":"TEXT","object_value":"Park County","observed_text":"Official Park County GIS is the county geography source for Alma.","predicate":"county_name","source_id":"src-co-alma-park-county-gis","source_locator":"Park County GIS","subject_id":"jurisdiction-co-alma","subject_type":"Jurisdiction"},{"assertion_id":"asrt-co-alma-election-date-2026","batch_id":"CO-NORM-002","confidence":"HIGH","jurisdiction_id":"jurisdiction-co-alma","normalized_status":"NORMALIZED","notes":"Used only for officials directly established by the 2026 result.","object_type":"DATE","object_value":"2026-04-07","observed_text":"The Town's 2026 municipal election was held April 7, 2026.","predicate":"election_date","source_id":"src-co-alma-elections","source_locator":"2026 Elections","subject_id":"jurisdiction-co-alma","subject_type":"Election"},{"assertion_id":"asrt-co-alma-governing-body","batch_id":"CO-NORM-002","confidence":"HIGH","jurisdiction_id":"jurisdiction-co-alma","normalized_status":"NORMALIZED","notes":"Normalized into 03_Body.","object_type":"TEXT","object_value":"Alma Board of Trustees","observed_text":"The Town identifies the Board of Trustees as its elected governing body.","predicate":"governing_body","source_id":"src-co-alma-board-trustees","source_locator":"Board of Trustees","subject_id":"body-co-alma-board-of-trustees","subject_type":"Body"},{"assertion_id":"asrt-co-alma-holder-andrew-zimmerman","batch_id":"CO-NORM-002","confidence":"HIGH","jurisdiction_id":"jurisdiction-co-alma","normalized_status":"NORMALIZED","notes":"Current holder normalized from newer post-election evidence; older Board page may be stale.","object_type":"ID","object_value":"office-co-alma-trustee","observed_text":"The 2026 Elections page identifies Andrew Zimmerman as a four-year Trustee.","predicate":"current_office","source_id":"src-co-alma-elections","source_locator":"2026 Elections","subject_id":"person-co-alma-andrew-zimmerman","subject_type":"Person"},{"assertion_id":"asrt-co-alma-holder-bob-kassel","batch_id":"CO-NORM-002","confidence":"HIGH","jurisdiction_id":"jurisdiction-co-alma","normalized_status":"NORMALIZED","notes":"Robert H. Kassel retained as alias from certified result.","object_type":"ID","object_value":"office-co-alma-mayor","observed_text":"The 2026 Elections page identifies Bob Kassel as Mayor.","predicate":"current_office","source_id":"src-co-alma-elections","source_locator":"2026 Elections","subject_id":"person-co-alma-bob-kassel","subject_type":"Person"},{"assertion_id":"asrt-co-alma-holder-cody-lefever","batch_id":"CO-NORM-002","confidence":"HIGH","jurisdiction_id":"jurisdiction-co-alma","normalized_status":"NORMALIZED","notes":"Current holder normalized.","object_type":"ID","object_value":"office-co-alma-trustee","observed_text":"The 2026 Elections page identifies Cody Lefever as a four-year Trustee.","predicate":"current_office","source_id":"src-co-alma-elections","source_locator":"2026 Elections","subject_id":"person-co-alma-cody-lefever","subject_type":"Person"},{"assertion_id":"asrt-co-alma-holder-ian-greene","batch_id":"CO-NORM-002","confidence":"HIGH","jurisdiction_id":"jurisdiction-co-alma","normalized_status":"NORMALIZED","notes":"Canonical spelling Ian Greene retained from official Board/2024 records; Ian Green retained as alias.","object_type":"ID","object_value":"office-co-alma-trustee","observed_text":"The 2026 Elections page identifies Ian Green as the continuing two-year Trustee position.","predicate":"current_office","source_id":"src-co-alma-elections","source_locator":"2026 Elections","subject_id":"person-co-alma-ian-greene","subject_type":"Person"},{"assertion_id":"asrt-co-alma-holder-paul-greguoli","batch_id":"CO-NORM-002","confidence":"HIGH","jurisdiction_id":"jurisdiction-co-alma","normalized_status":"NORMALIZED","notes":"Current holder normalized.","object_type":"ID","object_value":"office-co-alma-trustee","observed_text":"The 2026 Elections page identifies Paul Greguoli as a four-year Trustee.","predicate":"current_office","source_id":"src-co-alma-elections","source_locator":"2026 Elections","subject_id":"person-co-alma-paul-greguoli","subject_type":"Person"},{"assertion_id":"asrt-co-alma-mayor-scope","batch_id":"CO-NORM-002","confidence":"HIGH","jurisdiction_id":"jurisdiction-co-alma","normalized_status":"NORMALIZED","notes":"Normalized into Mayor office.","object_type":"TEXT","object_value":"TOWNWIDE","observed_text":"The Mayor is elected townwide.","predicate":"constituency","source_id":"src-co-alma-elections","source_locator":"2026 Elections","subject_id":"office-co-alma-mayor","subject_type":"Office"},{"assertion_id":"asrt-co-alma-mayor-term","batch_id":"CO-NORM-002","confidence":"HIGH","jurisdiction_id":"jurisdiction-co-alma","normalized_status":"NORMALIZED","notes":"Exact term end date is not inferred.","object_type":"NUMBER","object_value":"4","observed_text":"The 2026 Elections page identifies the Mayor term as four years.","predicate":"term_length_years","source_id":"src-co-alma-elections","source_locator":"2026 Elections","subject_id":"office-co-alma-mayor","subject_type":"Office"},{"assertion_id":"asrt-co-alma-reduced-board","batch_id":"CO-NORM-002","confidence":"HIGH","jurisdiction_id":"jurisdiction-co-alma","normalized_status":"NORMALIZED","notes":"Five total elected seats normalized.","object_type":"TEXT","object_value":"Mayor plus four Trustees","observed_text":"The 2026 election reduced the Board from six to four Trustees, effective with the April 7, 2026 municipal election.","predicate":"elected_composition","source_id":"src-co-alma-elections","source_locator":"2026 election / Ballot Question 1","subject_id":"body-co-alma-board-of-trustees","subject_type":"Body"},{"assertion_id":"asrt-co-alma-term-andrew-zimmerman","batch_id":"CO-NORM-002","confidence":"HIGH","jurisdiction_id":"jurisdiction-co-alma","normalized_status":"NORMALIZED","notes":"Exact swearing/start/end dates left blank.","object_type":"DATE","object_value":"2026-04-07","observed_text":"Certified 2026 result elected Andrew E. Zimmerman Trustee.","predicate":"selection_date","source_id":"src-co-alma-elections","source_locator":"2026 Final Official Election Results","subject_id":"role-co-alma-trustee-andrew-zimmerman","subject_type":"RoleTerm"},{"assertion_id":"asrt-co-alma-term-bob-kassel","batch_id":"CO-NORM-002","confidence":"HIGH","jurisdiction_id":"jurisdiction-co-alma","normalized_status":"NORMALIZED","notes":"Exact swearing/start/end dates left blank.","object_type":"DATE","object_value":"2026-04-07","observed_text":"Certified 2026 result elected Robert H. Kassel Mayor.","predicate":"selection_date","source_id":"src-co-alma-elections","source_locator":"2026 Final Official Election Results","subject_id":"role-co-alma-mayor-bob-kassel","subject_type":"RoleTerm"},{"assertion_id":"asrt-co-alma-term-cody-lefever","batch_id":"CO-NORM-002","confidence":"HIGH","jurisdiction_id":"jurisdiction-co-alma","normalized_status":"NORMALIZED","notes":"Exact swearing/start/end dates left blank.","object_type":"DATE","object_value":"2026-04-07","observed_text":"Certified 2026 result elected Cody Lefever Trustee through write-in results.","predicate":"selection_date","source_id":"src-co-alma-elections","source_locator":"2026 Final Official Election Results","subject_id":"role-co-alma-trustee-cody-lefever","subject_type":"RoleTerm"},{"assertion_id":"asrt-co-alma-term-ian-greene","batch_id":"CO-NORM-002","confidence":"HIGH","jurisdiction_id":"jurisdiction-co-alma","normalized_status":"NORMALIZED","notes":"Selection date intentionally blank.","object_type":"TEXT","object_value":"CONTINUING_2_YEAR_POSITION","obs